{
  "id": "go-if-else-01",
  "title": "Condicionales if/else",
  "language": "go",
  "concept": "conditionals",
  "description": "Aprende a usar if y else para tomar decisiones.",
  "explanation": [
    "La palabra reservada 'if' evalúa una condición: si es verdadera, ejecuta el bloque.",
    "La palabra reservada 'else' define qué hacer cuando la condición del 'if' es falsa.",
    "En Go, las condiciones NO llevan paréntesis (a diferencia de C o Java).",
    "Las llaves { } son obligatorias incluso para una sola línea de código."
  ],
  "code": "[[package]] main\n\n[[import]] \"fmt\"\n\n[[func]] main() {\n\tage := 18\n\t[[if]] age >= 18 {\n\t\tfmt.Println(\"Adult\")\n\t} [[else]] {\n\t\tfmt.Println(\"Minor\")\n\t}\n}",
  "mode": "strict",
  "difficulty": "beginner",
  "order": 5,
  "tags": ["basics", "conditionals", "if-else"]
}
