{
  "id": "py-lists-03",
  "title": "Listas en Python",
  "language": "python",
  "concept": "lists",
  "description": "Aprende a trabajar con listas en Python.",
  "explanation": [
    "Las listas en Python son colecciones ordenadas y mutables.",
    "Se crean con corchetes [] y pueden contener cualquier tipo de dato.",
    "Puedes usar append(), remove(), y len() para manipularlas."
  ],
  "code": "fruits = [\"apple\", \"banana\", \"cherry\"]\n\nfruits.append(\"orange\")\nprint(f\"Fruits: {fruits}\")\nprint(f\"Count: {len(fruits)}\")\n\nfor fruit in fruits:\n    print(f\"  - {fruit}\")",
  "mode": "strict",
  "difficulty": "beginner",
  "order": 3,
  "tags": ["basics", "lists", "collections"]
}
