{
  "id": "js-hello-world-01",
  "title": "Hola Mundo en JavaScript",
  "language": "javascript",
  "concept": "hello-world",
  "description": "Escribe tu primer programa en JavaScript.",
  "explanation": [
    "JavaScript es el lenguaje de la web.",
    "Usamos 'console.log()' para imprimir en la consola.",
    "Las sentencias terminan con punto y coma (;) aunque es opcional."
  ],
  "code": "console.log(\"Hello, World!\");",
  "mode": "strict",
  "difficulty": "beginner",
  "order": 1,
  "tags": ["basics", "hello-world"]
}
