{
  "id": "js-functions-03",
  "title": "Funciones en JavaScript",
  "language": "javascript",
  "concept": "functions",
  "description": "Aprende funciones cl치sicas y arrow functions.",
  "explanation": [
    "Hay dos formas de declarar funciones: 'function' y arrow '=>'.",
    "Las arrow functions son m치s concisas y se usan mucho en c칩digo moderno.",
    "Las funciones pueden tener par치metros con valores por defecto."
  ],
  "code": "function greet(name) {\n  return `Hello, ${name}!`;\n}\n\nconst add = (a, b) => a + b;\n\nconst multiply = (a, b) => {\n  const result = a * b;\n  return result;\n};\n\nconsole.log(greet(\"World\"));\nconsole.log(`5 + 3 = ${add(5, 3)}`);\nconsole.log(`4 * 7 = ${multiply(4, 7)}`);",
  "mode": "strict",
  "difficulty": "beginner",
  "order": 3,
  "tags": ["basics", "functions", "arrow-functions"]
}
