{
  "id": "js-objects-05",
  "title": "Objetos en JavaScript",
  "language": "javascript",
  "concept": "objects",
  "description": "Aprende a crear y manipular objetos en JavaScript.",
  "explanation": [
    "Los objetos son pares clave-valor, similares a los diccionarios.",
    "Se crean con llaves {} y se accede con punto (.) o corchetes ([]).",
    "La desestructuración permite extraer valores fácilmente."
  ],
  "code": "const person = {\n  name: \"Alice\",\n  age: 30,\n  city: \"Madrid\",\n};\n\nconsole.log(`Name: ${person.name}`);\nconsole.log(`Age: ${person.age}`);\n\nperson.email = \"alice@example.com\";\n\nconst { name, city } = person;\nconsole.log(`${name} lives in ${city}`);\n\nconst keys = Object.keys(person);\nconsole.log(`Keys: ${keys}`);",
  "mode": "strict",
  "difficulty": "beginner",
  "order": 5,
  "tags": ["basics", "objects"]
}
