{
  "id": "go-for-loop-01",
  "title": "Bucles con for",
  "language": "go",
  "concept": "loops",
  "description": "Go solo tiene un tipo de bucle: for.",
  "explanation": [
    "En Go, 'for' es la ÚNICA palabra reservada para bucles (no existe while ni do-while).",
    "La sintaxis clásica tiene 3 partes: for inicio; condición; incremento { cuerpo }.",
    "También se puede usar como while: for condición { } (sin inicio ni incremento).",
    "Ejemplo: 'for i := 0; i < 5; i++' itera 5 veces con i de 0 a 4."
  ],
  "code": "[[package]] main\n\n[[import]] \"fmt\"\n\n[[func]] main() {\n\t[[for]] i := 0; i < 5; i++ {\n\t\tfmt.Println(\"Count:\", i)\n\t}\n}",
  "mode": "strict",
  "difficulty": "beginner",
  "order": 6,
  "tags": ["basics", "loops", "for"]
}
