{
  "id": "go-channels-01",
  "title": "Canales y Goroutines",
  "language": "go",
  "concept": "concurrency",
  "description": "Concurrencia con goroutines y channels.",
  "explanation": [
    "Las goroutines son funciones que ejecutan concurrentemente con otras.",
    "Se lanzan con 'go' antes de la llamada a la función.",
    "Los channels permiten comunicación segura entre goroutines.",
    "'make(chan int)' crea un canal de enteros.",
    "'<-' envía o recibe datos del canal según el contexto."
  ],
  "code": "[[package]] main\n\n[[import]] (\n\t\"fmt\"\n\t\"time\"\n)\n\n[[func]] worker(id int, jobs <-chan int, results chan<- int) {\n\tfor j := range jobs {\n\t\tfmt.Printf(\"worker %d processing job %d\\n\", id, j)\n\t\ttime.Sleep(time.Second)\n\t\tresults <- j * 2\n\t}\n}\n\n[[func]] main() {\n\tjobs := make(chan int, 100)\n\tresults := make(chan int, 100)\n\n\tfor w := 1; w <= 3; w++ {\n\t\tgo worker(w, jobs, results)\n\t}\n\n\tfor j := 1; j <= 5; j++ {\n\t\tjobs <- j\n\t}\n\tclose(jobs)\n\n\tfor a := 1; a <= 5; a++ {\n\t\t<-results\n\t}\n}",
  "mode": "strict",
  "difficulty": "advanced",
  "order": 1,
  "tags": ["concurrency", "goroutines", "channels"]
}
