{
  "id": "py-dictionaries-05",
  "title": "Diccionarios en Python",
  "language": "python",
  "concept": "dictionaries",
  "description": "Aprende a usar diccionarios (mapas clave-valor) en Python.",
  "explanation": [
    "Los diccionarios almacenan pares clave-valor.",
    "Se crean con llaves {} y se accede a los valores con la clave.",
    "Son muy usados para representar objetos y configuraciones."
  ],
  "code": "person = {\n    \"name\": \"Alice\",\n    \"age\": 30,\n    \"city\": \"Madrid\"\n}\n\nprint(f\"Name: {person['name']}\")\nprint(f\"Age: {person['age']}\")\n\nperson[\"email\"] = \"alice@example.com\"\n\nfor key, value in person.items():\n    print(f\"  {key}: {value}\")",
  "mode": "strict",
  "difficulty": "beginner",
  "order": 5,
  "tags": ["basics", "dictionaries", "collections"]
}
