{
  "id": "go-short-variables-01",
  "title": "Variables cortas con :=",
  "language": "go",
  "concept": "short-variables",
  "description": "Usa la declaración corta := para crear variables.",
  "explanation": [
    "Go permite declarar variables de forma corta con el operador ':=' (dos puntos + igual).",
    "Con ':=' no necesitas escribir 'var' ni el tipo: Go lo infiere del valor asignado.",
    "Solo se puede usar ':=' dentro de funciones, no a nivel de paquete.",
    "Ejemplo: nombre := \"Gopher\" crea una variable string automáticamente."
  ],
  "code": "[[package]] main\n\n[[import]] \"fmt\"\n\n[[func]] main() {\n\tname [[:=]] \"Gopher\"\n\tage [[:=]] 10\n\tactive [[:=]] true\n\tfmt.Println(name, age, active)\n}",
  "mode": "strict",
  "difficulty": "beginner",
  "order": 3,
  "tags": ["basics", "variables", "short-declaration"]
}
